{
  "schemaVersion": 1,
  "provider": {
    "package": "@vitest/coverage-v8",
    "version": "4.1.9",
    "mapping": "ast-v8-to-istanbul@1.0.5:original-locations-v1"
  },
  "projects": ["unit", "contracts", "tooling", "integration"],
  "include": [
    "apps/*/src/**/*.ts",
    "apps/*/src/**/*.tsx",
    "packages/*/src/**/*.ts",
    "packages/*/src/**/*.tsx",
    "scripts/ci/**/*.mjs"
  ],
  "exclude": ["**/*.d.ts", "packages/testing/**"],
  "thresholds": {
    "changedLines": 80,
    "changedFunctionBranches": 70
  },
  "baseline": {
    "sourceSha": "5daedc92ff1dddda3917f8e956b9439cb239caef",
    "sourceState": "commit",
    "sourceTreeSha256": "a78a1d7466ccd45b17d992a7b6e7e4b3c46059cf68e2e77ee8a0119517fb68d4",
    "reportSha256": "e35fd0f7f33b9c4220f7faf0f6f82a9fc5abe230cd5eff23ffb5e811a51b4cbf",
    "lcovSha256": "e8ecb0bb3342ab66576114a0855393aba94943a92068611d9045d083f406527b",
    "strategySha256": "757503bf4cf95dd131bbce2495578d7483931325d87f3b17db6721c346bddc3b",
    "measuredAt": "2026-09-14T18:02:56.305Z",
    "groups": {
      "apps/admin-cli": {
        "lines": {
          "total": 438,
          "covered": 361,
          "pct": 82.420091
        },
        "branches": {
          "total": 502,
          "covered": 400,
          "pct": 79.681274
        },
        "functions": {
          "total": 50,
          "covered": 36,
          "pct": 72
        },
        "statements": {
          "total": 478,
          "covered": 382,
          "pct": 79.916317
        }
      },
      "apps/agent-service": {
        "lines": {
          "total": 3116,
          "covered": 2628,
          "pct": 84.338896
        },
        "branches": {
          "total": 3069,
          "covered": 2424,
          "pct": 78.983382
        },
        "functions": {
          "total": 664,
          "covered": 536,
          "pct": 80.722891
        },
        "statements": {
          "total": 3413,
          "covered": 2777,
          "pct": 81.365367
        }
      },
      "apps/control-center": {
        "lines": {
          "total": 2169,
          "covered": 1871,
          "pct": 86.260949
        },
        "branches": {
          "total": 2494,
          "covered": 1986,
          "pct": 79.631114
        },
        "functions": {
          "total": 579,
          "covered": 450,
          "pct": 77.720207
        },
        "statements": {
          "total": 2407,
          "covered": 1997,
          "pct": 82.966348
        }
      },
      "apps/execution-worker": {
        "lines": {
          "total": 970,
          "covered": 796,
          "pct": 82.061855
        },
        "branches": {
          "total": 922,
          "covered": 707,
          "pct": 76.681127
        },
        "functions": {
          "total": 195,
          "covered": 155,
          "pct": 79.487179
        },
        "statements": {
          "total": 1061,
          "covered": 826,
          "pct": 77.851083
        }
      },
      "packages/application": {
        "lines": {
          "total": 4631,
          "covered": 3926,
          "pct": 84.776506
        },
        "branches": {
          "total": 5005,
          "covered": 3962,
          "pct": 79.160839
        },
        "functions": {
          "total": 997,
          "covered": 914,
          "pct": 91.675025
        },
        "statements": {
          "total": 4979,
          "covered": 4148,
          "pct": 83.309901
        }
      },
      "packages/domain": {
        "lines": {
          "total": 158,
          "covered": 142,
          "pct": 89.873417
        },
        "branches": {
          "total": 144,
          "covered": 120,
          "pct": 83.333333
        },
        "functions": {
          "total": 70,
          "covered": 65,
          "pct": 92.857142
        },
        "statements": {
          "total": 165,
          "covered": 147,
          "pct": 89.090909
        }
      },
      "packages/execution-contracts": {
        "lines": {
          "total": 680,
          "covered": 636,
          "pct": 93.529411
        },
        "branches": {
          "total": 838,
          "covered": 767,
          "pct": 91.527446
        },
        "functions": {
          "total": 118,
          "covered": 118,
          "pct": 100
        },
        "statements": {
          "total": 696,
          "covered": 649,
          "pct": 93.247126
        }
      },
      "packages/gateway-contracts": {
        "lines": {
          "total": 303,
          "covered": 292,
          "pct": 96.369636
        },
        "branches": {
          "total": 148,
          "covered": 136,
          "pct": 91.891891
        },
        "functions": {
          "total": 50,
          "covered": 50,
          "pct": 100
        },
        "statements": {
          "total": 311,
          "covered": 299,
          "pct": 96.141479
        }
      },
      "packages/integration-github": {
        "lines": {
          "total": 297,
          "covered": 243,
          "pct": 81.818181
        },
        "branches": {
          "total": 243,
          "covered": 178,
          "pct": 73.251028
        },
        "functions": {
          "total": 54,
          "covered": 47,
          "pct": 87.037037
        },
        "statements": {
          "total": 315,
          "covered": 251,
          "pct": 79.682539
        }
      },
      "packages/integration-web": {
        "lines": {
          "total": 145,
          "covered": 137,
          "pct": 94.482758
        },
        "branches": {
          "total": 106,
          "covered": 92,
          "pct": 86.792452
        },
        "functions": {
          "total": 24,
          "covered": 22,
          "pct": 91.666666
        },
        "statements": {
          "total": 170,
          "covered": 156,
          "pct": 91.764705
        }
      },
      "packages/memory-mem0": {
        "lines": {
          "total": 139,
          "covered": 119,
          "pct": 85.61151
        },
        "branches": {
          "total": 114,
          "covered": 82,
          "pct": 71.929824
        },
        "functions": {
          "total": 24,
          "covered": 24,
          "pct": 100
        },
        "statements": {
          "total": 149,
          "covered": 122,
          "pct": 81.879194
        }
      },
      "packages/persistence-sqlite": {
        "lines": {
          "total": 6021,
          "covered": 5164,
          "pct": 85.766483
        },
        "branches": {
          "total": 4871,
          "covered": 3754,
          "pct": 77.068363
        },
        "functions": {
          "total": 1330,
          "covered": 1222,
          "pct": 91.879699
        },
        "statements": {
          "total": 6390,
          "covered": 5338,
          "pct": 83.536776
        }
      },
      "packages/platform-node": {
        "lines": {
          "total": 5076,
          "covered": 4296,
          "pct": 84.633569
        },
        "branches": {
          "total": 4255,
          "covered": 3286,
          "pct": 77.226792
        },
        "functions": {
          "total": 954,
          "covered": 819,
          "pct": 85.849056
        },
        "statements": {
          "total": 5501,
          "covered": 4497,
          "pct": 81.748772
        }
      },
      "packages/runtime-pi": {
        "lines": {
          "total": 1009,
          "covered": 835,
          "pct": 82.755203
        },
        "branches": {
          "total": 1000,
          "covered": 730,
          "pct": 73
        },
        "functions": {
          "total": 183,
          "covered": 152,
          "pct": 83.060109
        },
        "statements": {
          "total": 1129,
          "covered": 908,
          "pct": 80.425155
        }
      },
      "packages/runtime-sandbox": {
        "lines": {
          "total": 899,
          "covered": 771,
          "pct": 85.761957
        },
        "branches": {
          "total": 891,
          "covered": 741,
          "pct": 83.164983
        },
        "functions": {
          "total": 193,
          "covered": 150,
          "pct": 77.720207
        },
        "statements": {
          "total": 1009,
          "covered": 838,
          "pct": 83.052527
        }
      },
      "scripts/ci": {
        "lines": {
          "total": 3458,
          "covered": 3302,
          "pct": 95.488721
        },
        "branches": {
          "total": 2723,
          "covered": 2484,
          "pct": 91.222915
        },
        "functions": {
          "total": 542,
          "covered": 532,
          "pct": 98.154981
        },
        "statements": {
          "total": 3774,
          "covered": 3573,
          "pct": 94.674085
        }
      }
    }
  }
}
